### ISSUE TITLE
NN_PUSH send twice message everytime

### ISSUE THREAD

**Issue by taolinke** [nanomsg/nanomsg#609]
here is what i got use tcpdump:
17:59:54.991879 IP 192.168.167.12.34683 > 192.168.167.1.3337: Flags [P.], seq 422:633, ack 1, win 115, options [nop,nop,TS val 52161 ecr 85021
], length 211
.....
17:59:54.991888 IP 192.168.167.12.34683 > 192.168.167.1.3337: Flags [P.], seq 422:633, ack 1, win 115, options [nop,nop,TS val 52161 ecr 85021
], length 211
.....
As u see, why is that?

**Comment by gdamore** [comment]
That looks quite strange. I cannot explain off the top of my head right now.

**Comment by taolinke** [comment]
The version is nanomsg-0.8-beta,not only NN_PUSH in tcp ,but also NN_PUB,like this:
09:52:43.714940 IP 192.168.167.1.3336 > 192.168.167.11.43367: Flags [P.], seq 146:292, ack 1, win 114, options [nop,nop,TS val 51947767 ecr 51
908718], length 146
        0x0000:  4500 00c6 463e 4000 4006 2496 c0a8 a701  E...F>@.@.$.....
        0x0010:  c0a8 a70b 0d08 a967 5a1e 3dae 2bef e178  .......gZ.=.+..x
        0x0020:  8018 0072 d016 0000 0101 080a 0318 a8f7  ...r............
        0x0030:  0318 106e 0000 0000 0000 008a 3746 3235  ...n........7F25
        0x0040:  4541 4334 2d34 4641 342d 3434 4136 2d38  EAC4-4FA4-44A6-8
        0x0050:  3039 412d 3333 3443 3946 4636 3137 3045  09A-334C9FF6170E
        0x0060:  0009 7b22 7673 6d74 7970 6522 3a31 2c22  ..{"vsmtype":1,"
        0x0070:  7673 6d69 6422 3a22 3746 3235 4541 4334  vsmid":"7F25EAC4
        0x0080:  2d34 4641 342d 3434 4136 2d38 3039 412d  -4FA4-44A6-809A-
        0x0090:  3333 3443 3946 4636 3137 3045 222c 2274  334C9FF6170E","t
        0x00a0:  7970 6522 3a31 2c22 7265 7175 6573 7469  ype":1,"requesti
        0x00b0:  6422 3a22 5461 7373 5265 706f 7274 6572  d":"TassReporter
        0x00c0:  3030 3030 227d                           0000"}
09:52:43.714944 IP 192.168.167.1.3336 > 192.168.167.11.43367: Flags [P.], seq 146:292, ack 1, win 114, options [nop,nop,TS val 51947767 ecr 51
908718], length 146
        0x0000:  4500 00c6 463e 4000 4006 2496 c0a8 a701  E...F>@.@.$.....
        0x0010:  c0a8 a70b 0d08 a967 5a1e 3dae 2bef e178  .......gZ.=.+..x
        0x0020:  8018 0072 d016 0000 0101 080a 0318 a8f7  ...r............
        0x0030:  0318 106e 0000 0000 0000 008a 3746 3235  ...n........7F25
        0x0040:  4541 4334 2d34 4641 342d 3434 4136 2d38  EAC4-4FA4-44A6-8
        0x0050:  3039 412d 3333 3443 3946 4636 3137 3045  09A-334C9FF6170E
        0x0060:  0009 7b22 7673 6d74 7970 6522 3a31 2c22  ..{"vsmtype":1,"
        0x0070:  7673 6d69 6422 3a22 3746 3235 4541 4334  vsmid":"7F25EAC4
        0x0080:  2d34 4641 342d 3434 4136 2d38 3039 412d  -4FA4-44A6-809A-
        0x0090:  3333 3443 3946 4636 3137 3045 222c 2274  334C9FF6170E","t
        0x00a0:  7970 6522 3a31 2c22 7265 7175 6573 7469  ype":1,"requesti
        0x00b0:  6422 3a22 5461 7373 5265 706f 7274 6572  d":"TassReporter
        0x00c0:  3030 3030 227d                           0000"}

**Comment by taolinke** [comment]
it's the network problem.
